<?xml version="1.0" encoding="UTF-8"?>
<!-- P. Al. -->
<!-- Generic properties file-->
<!ELEMENT PROPERTIES (PROPERTY*)>
<!ELEMENT PROPERTY (#PCDATA)>
<!ATTLIST PROPERTY
	NAME CDATA #REQUIRED
>
